{
  "id": "caro-kann",
  "title": "Защита Каро — Канн",
  "subtitle": "Надёжный ответ на 1.e4",
  "side": "b",
  "eco": "B10–B19",
  "level": "Базовый курс",
  "history": "Названа в честь Горацио Каро и Маркуса Канна, анализировавших защиту в XIX веке. Её применяли многие чемпионы мира.",
  "idea": "Ход ...c6 готовит ...d5. В отличие от французской защиты, белопольный слон c8 может выйти до ...e6.",
  "structure": "В варианте продвижения белые имеют d4/e5, чёрные — c6/d5. Главный подрыв чёрных — ...c5. В разменном варианте пешка c переходит на d5.",
  "plans": [
    "Вывести слона c8 до ...e6, если позиция позволяет.",
    "Развить коней, рокировать и подрывать центр ...c5 или ...f6 после подготовки."
  ],
  "opponentPlans": [
    "Удерживать пространство с e5.",
    "В разменном варианте развиться быстро и давить на центр."
  ],
  "mistakes": [
    "Играть ...e6 автоматически и запирать слона.",
    "Брать пешку d4, не считая тактику по линии e."
  ],
  "traps": [
    "После Bf5 белые иногда выигрывают темпы ходами h4 и h5. Нужно предусмотреть поле для слона и не недооценивать пешечную атаку."
  ],
  "after": "Ищите удобный момент для ...c5. Обмен центральных пешек помогает освободить фигуры; пассивная защита без подрывов уступает белым всё пространство.",
  "root": {
    "id": "caro-kann-root",
    "comment": "Начальная позиция. Выбирайте ходы в дереве или нажимайте стрелку вперёд.",
    "children": [
      {
        "id": "caro-kann-n1",
        "move": "e2e4",
        "children": [
          {
            "id": "caro-kann-n2",
            "move": "c7c6",
            "children": [
              {
                "id": "caro-kann-n3",
                "move": "d2d4",
                "children": [
                  {
                    "id": "caro-kann-n4",
                    "move": "d7d5",
                    "children": [
                      {
                        "id": "caro-kann-n5",
                        "move": "e4e5",
                        "children": [
                          {
                            "id": "caro-kann-n6",
                            "move": "c8f5",
                            "children": [
                              {
                                "id": "caro-kann-n7",
                                "move": "g1f3",
                                "children": [
                                  {
                                    "id": "caro-kann-n8",
                                    "move": "e7e6",
                                    "children": [
                                      {
                                        "id": "caro-kann-n9",
                                        "move": "f1e2",
                                        "children": [
                                          {
                                            "id": "caro-kann-n10",
                                            "move": "c6c5",
                                            "children": [
                                              {
                                                "id": "caro-kann-n11",
                                                "move": "e1g1",
                                                "children": [
                                                  {
                                                    "id": "caro-kann-n12",
                                                    "move": "b8c6",
                                                    "children": []
                                                  }
                                                ]
                                              }
                                            ],
                                            "comment": "...c5 — тематический подрыв пешки d4."
                                          }
                                        ]
                                      }
                                    ]
                                  }
                                ]
                              }
                            ],
                            "comment": "Слон c8 выходит за пешечную цепь."
                          }
                        ]
                      },
                      {
                        "id": "caro-kann-n13",
                        "move": "b1c3",
                        "children": [
                          {
                            "id": "caro-kann-n14",
                            "move": "d5e4",
                            "children": [
                              {
                                "id": "caro-kann-n15",
                                "move": "c3e4",
                                "children": [
                                  {
                                    "id": "caro-kann-n16",
                                    "move": "c8f5",
                                    "children": [
                                      {
                                        "id": "caro-kann-n17",
                                        "move": "e4g3",
                                        "children": [
                                          {
                                            "id": "caro-kann-n18",
                                            "move": "f5g6",
                                            "children": [
                                              {
                                                "id": "caro-kann-n19",
                                                "move": "h2h4",
                                                "children": [
                                                  {
                                                    "id": "caro-kann-n20",
                                                    "move": "h7h6",
                                                    "children": [],
                                                    "comment": "Поле h7 может пригодиться слону. Дальше — развитие и внимательный контроль атаки белых."
                                                  }
                                                ]
                                              }
                                            ]
                                          }
                                        ]
                                      }
                                    ],
                                    "comment": "Активное развитие слона с темпом на коня."
                                  }
                                ]
                              }
                            ]
                          }
                        ]
                      },
                      {
                        "id": "caro-kann-n21",
                        "move": "e4d5",
                        "children": [
                          {
                            "id": "caro-kann-n22",
                            "move": "c6d5",
                            "children": [
                              {
                                "id": "caro-kann-n23",
                                "move": "f1d3",
                                "children": [
                                  {
                                    "id": "caro-kann-n24",
                                    "move": "b8c6",
                                    "children": [
                                      {
                                        "id": "caro-kann-n25",
                                        "move": "c2c3",
                                        "children": [
                                          {
                                            "id": "caro-kann-n26",
                                            "move": "g8f6",
                                            "children": [],
                                            "comment": "Развивайте фигуры и не рассчитывайте на автоматическое преимущество от крепкой структуры."
                                          }
                                        ]
                                      }
                                    ]
                                  }
                                ]
                              }
                            ],
                            "comment": "Разменная структура: полуоткрытая линия c и симметричные центральные пешки."
                          }
                        ]
                      }
                    ]
                  }
                ]
              }
            ],
            "comment": "...c6 поддерживает будущую пешку d5."
          }
        ]
      }
    ]
  },
  "practice": [
    "e2e4",
    "c7c6",
    "d2d4",
    "d7d5",
    "e4e5",
    "c8f5",
    "g1f3",
    "e7e6",
    "f1e2",
    "c6c5",
    "e1g1",
    "b8c6"
  ],
  "schemaVersion": 1,
  "version": 1
}
