{
  "id": "italian",
  "title": "Итальянская партия",
  "subtitle": "Развитие с ясным планом",
  "side": "w",
  "eco": "C50–C59",
  "level": "Базовый курс",
  "history": "Один из старейших открытых дебютов, исследованный итальянскими мастерами XVI–XVII веков. Слон c4 смотрит на слабое поле f7.",
  "idea": "Развить лёгкие фигуры, быстро рокировать и подготовить центральный прорыв. Давление на f7 полезно, но атака должна опираться на развитие.",
  "structure": "Часто белые строят c3–d3–e4. Прорыв d4 меняет закрытый центр на открытые линии.",
  "plans": [
    "Рокировать и подготовить d4 через c3 и Re1.",
    "В спокойных линиях провести Nb1–d2–f1–g3."
  ],
  "opponentPlans": [
    "Развиться через ...Bc5 или ...Nf6.",
    "Подготовить ...d5 и контролировать центр."
  ],
  "mistakes": [
    "Начинать атаку на f7, оставив короля в центре.",
    "Не заметить контрудар ...d5 в защите двух коней."
  ],
  "traps": [
    "После ...Nf6 и Ng5 чёрные отвечают ...d5. После exd5 основное ...Na5 уводит коня из центра с атакой на слона.",
    "5...Nxd5?! допускает Nxf7 и атаку «жареной печени». Это не повод автоматически жертвовать коня в других позициях."
  ],
  "after": "Выбирайте между d4 и медленным улучшением коня. После открытия центра ладьи должны занять линии e и d.",
  "root": {
    "id": "italian-root",
    "comment": "Начальная позиция. Выбирайте ходы в дереве или нажимайте стрелку вперёд.",
    "children": [
      {
        "id": "italian-n1",
        "move": "e2e4",
        "children": [
          {
            "id": "italian-n2",
            "move": "e7e5",
            "children": [
              {
                "id": "italian-n3",
                "move": "g1f3",
                "children": [
                  {
                    "id": "italian-n4",
                    "move": "b8c6",
                    "children": [
                      {
                        "id": "italian-n5",
                        "move": "f1c4",
                        "children": [
                          {
                            "id": "italian-n6",
                            "move": "f8c5",
                            "children": [
                              {
                                "id": "italian-n7",
                                "move": "c2c3",
                                "children": [
                                  {
                                    "id": "italian-n8",
                                    "move": "g8f6",
                                    "children": [
                                      {
                                        "id": "italian-n9",
                                        "move": "d2d3",
                                        "children": [
                                          {
                                            "id": "italian-n10",
                                            "move": "d7d6",
                                            "children": [
                                              {
                                                "id": "italian-n11",
                                                "move": "e1g1",
                                                "children": [
                                                  {
                                                    "id": "italian-n12",
                                                    "move": "e8g8",
                                                    "children": [],
                                                    "comment": "Начинается маневренная игра. Развивайте коня b1 и ищите подходящий момент для d4."
                                                  }
                                                ]
                                              }
                                            ]
                                          }
                                        ]
                                      }
                                    ]
                                  }
                                ],
                                "comment": "c3 готовит d4, но сейчас надёжно сначала укрепить центр ходом d3."
                              }
                            ]
                          },
                          {
                            "id": "italian-n13",
                            "move": "g8f6",
                            "children": [
                              {
                                "id": "italian-n14",
                                "move": "f3g5",
                                "children": [
                                  {
                                    "id": "italian-n15",
                                    "move": "d7d5",
                                    "children": [
                                      {
                                        "id": "italian-n16",
                                        "move": "e4d5",
                                        "children": [
                                          {
                                            "id": "italian-n17",
                                            "move": "c6a5",
                                            "children": [],
                                            "comment": "Основное ...Na5 атакует слона и избегает опасной жертвы на f7."
                                          },
                                          {
                                            "id": "italian-n18",
                                            "move": "f6d5",
                                            "children": [
                                              {
                                                "id": "italian-n19",
                                                "move": "g5f7",
                                                "children": [
                                                  {
                                                    "id": "italian-n20",
                                                    "move": "e8f7",
                                                    "children": [
                                                      {
                                                        "id": "italian-n21",
                                                        "move": "d1f3",
                                                        "children": [
                                                          {
                                                            "id": "italian-n22",
                                                            "move": "f7e6",
                                                            "children": [
                                                              {
                                                                "id": "italian-n23",
                                                                "move": "b1c3",
                                                                "children": [],
                                                                "comment": "Конь развивается с угрозой коню d5. Король чёрных задержан в центре."
                                                              }
                                                            ]
                                                          }
                                                        ]
                                                      }
                                                    ]
                                                  }
                                                ],
                                                "comment": "Nxf7 — тематическая жертва. Продолжать нужно с развитием и шахами, а не пытаться сразу вернуть всё."
                                              }
                                            ],
                                            "comment": "...Nxd5?! выглядит естественно, но создаёт тактические проблемы."
                                          }
                                        ]
                                      }
                                    ]
                                  }
                                ]
                              }
                            ],
                            "comment": "Защита двух коней: чёрные немедленно атакуют e4."
                          }
                        ],
                        "comment": "Слон c4 контролирует f7 и d5."
                      }
                    ]
                  }
                ]
              }
            ]
          }
        ]
      }
    ]
  },
  "practice": [
    "e2e4",
    "e7e5",
    "g1f3",
    "b8c6",
    "f1c4",
    "f8c5",
    "c2c3",
    "g8f6",
    "d2d3",
    "d7d6",
    "e1g1",
    "e8g8"
  ],
  "schemaVersion": 1,
  "version": 1
}
